{
  "artifactKind": "ATTRIBUTION_DELIVERY_REVIEW_PROPOSAL",
  "schemaVersion": "1.0.0",
  "publicationAuthorization": "NOT_GRANTED",
  "scopeId": "spell-formula-observations-v1-literals",
  "appliesTo": "Only separately authorized SpellDto.formulaObservations, not the complete Spell response",
  "delivery": {
    "proposedRoute": "/api/attributions/spell-formulas-v1",
    "responseLinkRelation": "describedby",
    "bundledNoticeName": "THIRD-PARTY-NOTICES.md",
    "catalogVersion": "spell-formulas-v1-notices-1",
    "blanketResponseLicenseHeader": false
  },
  "notices": [
    {
      "id": "wizards-srd-5.1",
      "documentId": "SRD-5.1",
      "documentVersion": "5.1",
      "documentUrl": "https://media.dndbeyond.com/compendium-images/srd/5.1/SRD_CC_v5.1.pdf",
      "documentSha256": "2504d2a0abb0a4d491a939be4f17910a2dde0312570ab8d208080225ccf0a1f0",
      "licenseId": "CC-BY-4.0",
      "licenseUrl": "https://creativecommons.org/licenses/by/4.0/legalcode.en",
      "requiredAttribution": "This work includes material taken from the System Reference Document 5.1 (“SRD 5.1”) by Wizards of the Coast LLC and available at https://dnd.wizards.com/resources/systems-reference-document. The SRD 5.1 is licensed under the Creative Commons Attribution 4.0 International License available at https://creativecommons.org/licenses/by/4.0/legalcode.",
      "requiredAttributionSha256": "fe6f4d81a21fc59660294af4729cfc6a505f3b01f474e5074553492ba3cfc3fe",
      "disclaimerReference": "https://creativecommons.org/licenses/by/4.0/legalcode.en#s5",
      "disclaimerNotice": "Section 5 of CC-BY-4.0 includes a Disclaimer of Warranties and Limitation of Liability.",
      "p1bNoticeReference": {
        "artifactId": "p1b-attribution",
        "artifactSha256": "d882fdd4d68d2847dd47adfd51e0c91e8baaad3cbfa49072eb98b69eb19e8020",
        "jsonPointer": "/notices/0",
        "valueSha256": "76aafc4ead648c751113594499b5793fecae74abc6e12e9ef3d0926a7553431e"
      }
    },
    {
      "id": "wizards-srd-5.2.1",
      "documentId": "SRD-5.2.1",
      "documentVersion": "5.2.1",
      "documentUrl": "https://media.dndbeyond.com/compendium-images/srd/5.2/SRD_CC_v5.2.1.pdf",
      "documentSha256": "8974902d109d6e63672d7c490bde9ccf052410503d9cfa768237154fbc5e3d87",
      "licenseId": "CC-BY-4.0",
      "licenseUrl": "https://creativecommons.org/licenses/by/4.0/legalcode.en",
      "requiredAttribution": "This work includes material from the System Reference Document 5.2.1 (“SRD 5.2.1”) by Wizards of the Coast LLC, available at https://www.dndbeyond.com/srd. The SRD 5.2.1 is licensed under the Creative Commons Attribution 4.0 International License, available at https://creativecommons.org/licenses/by/4.0/legalcode.",
      "requiredAttributionSha256": "f2e3568c8377f47c48dab84d64d1fc08aed723f0efabcb8a26e91c761cb59171",
      "disclaimerReference": "https://creativecommons.org/licenses/by/4.0/legalcode.en#s5",
      "disclaimerNotice": "Section 5 of CC-BY-4.0 includes a Disclaimer of Warranties and Limitation of Liability.",
      "p1bNoticeReference": {
        "artifactId": "p1b-attribution",
        "artifactSha256": "d882fdd4d68d2847dd47adfd51e0c91e8baaad3cbfa49072eb98b69eb19e8020",
        "jsonPointer": "/notices/2",
        "valueSha256": "64611abd5df669d409dac97932b04a13e4e25a279ce54a9f860f6dfaed0ca2f5"
      }
    }
  ],
  "changesDisclosure": "Selected formula expressions were extracted into structured observations and reformatted; surrounding rule text and source markup are omitted. No gameplay effect or rules execution is asserted.",
  "changesDisclosureSha256": "d5530565117d676c7844bb90b93c38afc8710a0e0a26a494de337c6d65f1ddb1",
  "downstreamNote": "API discovery does not by itself establish compliance for every downstream redistribution.",
  "review": {
    "status": "PENDING_REVIEW",
    "decision": null,
    "reviewerId": null,
    "reviewerAuthorityRef": null,
    "decisionId": null,
    "rationale": null,
    "reviewedAt": null,
    "releaseScopeId": null,
    "decisionRecordRef": null
  }
}
